{
  "$schema": "http://json-schema.org/draft-07/schema#",
  "$id": "https://curavias/schema/dc-insight-v1",
  "title": "Actionable-Insight Contract (DC-INSIGHT-v1)",
  "description": "Sprint 26 WS-D consumption contract for the 5-beat actionable-insight tuple (design spec Sec 3.1, docs/superpowers/specs/2026-07-23-sprint-26-decision-ontology-actionable-insight-design.md). A grounded copilot answer is a signal + understanding + recommendation + action + coordination + provenance tuple, not a free-form sentence. Unlike the dc-*-v1 dataset envelopes in this folder, this contract describes a single answer instance (not a {records:[...]} collection): the top level IS the six beats. The Fabric Data Agent (da_hospital_capacity) emits the signal, understanding, and provenance beats; the agent-host assembles the recommendation, action, and coordination beats at runtime. No PHI by construction: provenance.concepts reference only hcp:* reference-layer concepts (ward/bed aggregates), never patient identifiers. See docs/ontology/reference-layer.ttl and docs/ontology/crosswalk.md.",
  "type": "object",
  "additionalProperties": false,
  "required": [
    "signal", "understanding", "recommendation", "action", "coordination", "provenance"
  ],
  "properties": {
    "signal": {
      "type": "object",
      "description": "The observed metric breach or condition that triggered the insight.",
      "additionalProperties": false,
      "required": ["metric", "value", "unit", "threshold", "breach", "scope", "horizon_h"],
      "properties": {
        "metric":    { "type": "string", "minLength": 1, "description": "Metric identifier, e.g. occupancy_pct." },
        "value":     { "type": "number", "description": "Observed or forecast metric value." },
        "unit":      { "type": "string", "minLength": 1, "description": "Unit of the metric value, e.g. %." },
        "threshold": { "type": "number", "description": "Threshold value the metric is compared against." },
        "breach":    { "type": "boolean", "description": "True when value breaches threshold." },
        "scope":     { "type": "string", "pattern": "^hcp:", "description": "hcp:* concept reference identifying the scope, e.g. hcp:Ward/Medicine A." },
        "horizon_h": { "type": "integer", "minimum": 0, "description": "Forecast horizon offset in hours (0 = current state)." }
      }
    },
    "understanding": {
      "type": "object",
      "description": "Explanatory decomposition of the signal into contributing drivers.",
      "additionalProperties": false,
      "required": ["drivers"],
      "properties": {
        "drivers": {
          "type": "array",
          "minItems": 1,
          "items": {
            "type": "object",
            "additionalProperties": false,
            "required": ["factor", "delta"],
            "properties": {
              "factor": { "type": "string", "minLength": 1, "description": "Driver factor name, e.g. forecast_admissions." },
              "delta":  { "type": "number", "description": "Signed contribution of this factor to the signal." },
              "note":   { "type": "string", "description": "Optional free-text context, e.g. flu season." }
            }
          }
        }
      }
    },
    "recommendation": {
      "type": "array",
      "description": "Ranked lever recommendations addressing the signal. Assembled at runtime by the agent-host from the lever catalog (data-platform/decision/levers/<role>.yaml).",
      "minItems": 1,
      "items": {
        "type": "object",
        "additionalProperties": false,
        "required": ["lever_id", "params", "expected_impact", "owner_role", "deadline"],
        "properties": {
          "lever_id":  { "type": "string", "minLength": 1, "description": "Lever catalog identifier, e.g. OOA-EXPEDITE-DISCHARGE." },
          "params":    { "type": "object", "description": "Lever-specific parameters as defined by the lever's params_schema." },
          "expected_impact": {
            "type": "object",
            "additionalProperties": false,
            "required": ["metric", "delta"],
            "properties": {
              "metric": { "type": "string", "minLength": 1 },
              "delta":  { "type": "number" }
            }
          },
          "owner_role": { "type": "string", "minLength": 1, "description": "Role responsible for executing the lever, e.g. dca." },
          "deadline":   { "type": "string", "format": "date-time" }
        }
      }
    },
    "action": {
      "type": "object",
      "description": "Advisory-only + HITL action state for the selected recommendation (Cosmos proposed_actions record).",
      "additionalProperties": false,
      "required": ["status", "hitl", "cosmos_id"],
      "properties": {
        "status": { "type": "string", "enum": ["proposed", "approved", "rejected", "applied"] },
        "hitl":   { "type": "string", "enum": ["required", "approved"] },
        "cosmos_id": { "type": "string", "minLength": 1, "description": "Identifier of the proposed_actions record in Cosmos." }
      }
    },
    "coordination": {
      "type": "object",
      "description": "Cross-role Plan / CapacityEpisode context and handoff routing.",
      "additionalProperties": false,
      "required": ["plan_id", "golden_thread", "handoff"],
      "properties": {
        "plan_id":       { "type": "string", "minLength": 1, "description": "Identifier of the Cosmos plans record." },
        "golden_thread": { "type": "string", "minLength": 1, "description": "Human-readable narrative summary, e.g. Medicine A 102% -> 94%." },
        "handoff":       { "type": "string", "minLength": 1, "description": "Receiving role for this recommendation, e.g. dca." }
      }
    },
    "provenance": {
      "type": "object",
      "description": "Grounding provenance for the answer; no PHI by construction.",
      "additionalProperties": false,
      "required": ["concepts", "confidence", "source_trust"],
      "properties": {
        "concepts": {
          "type": "array",
          "minItems": 1,
          "items": { "type": "string", "pattern": "^hcp:" }
        },
        "confidence":   { "type": "number", "minimum": 0, "maximum": 1 },
        "source_trust": { "type": "string", "enum": ["A", "B", "C"] }
      }
    }
  }
}
